{
  "meta": {
    "title": "Mac Mini M4 · node",
    "description": "Node page for the Mac Mini M4: reachable by which route with probe times (Tailscale ssh 20:43 ok; WARP route present, ping and ssh fail), the four seats on it and their last writebacks, capacity from sysctl/df/pmset, the placement rule, the other nodes, evidence. No addresses on the page.",
    "stream": "now",
    "crumb": [
      {
        "label": "Templates",
        "href": "/"
      },
      {
        "label": "U22 · Node",
        "href": "/t/U22/"
      },
      {
        "label": "Mac Mini M4"
      }
    ],
    "actions": [
      {
        "label": "ESTATE.md",
        "href": "https://github.com/sisodias/siso-agent-zero-protocol",
        "icon": "map",
        "external": true
      },
      {
        "label": "Now",
        "href": "/t/U10/example/",
        "icon": "activity"
      }
    ],
    "source": "ssh over Tailscale (hostname, sysctl hw.model/hw.memsize, sw_vers, uptime, df -h /, pmset -g, herdr --version, codex --version, curl :8080) 6 Sep 20:43 UTC+07 · 00_AGENT_ZERO/bin/mini-probe 20:43 · mini-herdr agent list 20:38 · atlas/now.json 20:29 · ledger/2026-09-06-mini-native-pilot.json · briefs/MINI-SYNC.md (6 Sep 00:30) · estate/MINI-STATUS.md (5 Sep) · ESTATE.md (1e5e61e, 5 Sep 18:36) · OWNERS.md LAPTOP-ORGANIZER 5 Sep 19:59"
  },
  "heading": {
    "breadcrumb": [
      {
        "label": "Estate",
        "href": "/t/U9/example/"
      },
      {
        "label": "nodes"
      },
      {
        "label": "Mac Mini M4"
      }
    ],
    "kicker": "node <span class=\"sep\">·</span> Mac Mini M4 <span class=\"sep\">·</span> <span class=\"dim\">always-on runtime · 4 seats · reachable over Tailscale</span>",
    "title": "Mac Mini M4",
    "subtitle": "The always-on box: herdr server, four Codex seats, Bifrost, sleep prevented. Reachable right now over Tailscale (ssh answered at 20:43); the Cloudflare WARP private route is present but does not carry ping or ssh today. Every fact below carries the probe that produced it.",
    "badges": [
      {
        "label": "reachable · Tailscale · 20:43",
        "tone": "now",
        "dot": true,
        "href": "#reach"
      },
      {
        "label": "WARP route · no reply · 20:43",
        "tone": "blocked",
        "href": "#reach"
      },
      {
        "label": "4 seats · 2 idle · 2 done",
        "tone": "agents",
        "href": "#runs"
      },
      {
        "label": "up 8 d 23 h",
        "tone": "now",
        "href": "#capacity"
      },
      {
        "label": "17 GiB disk free",
        "tone": "warn",
        "href": "#capacity"
      },
      {
        "label": "no addresses on this page",
        "tone": "muted",
        "icon": "lock"
      }
    ],
    "status": {
      "kicker": "Last probe",
      "value": "20:43 +07 · ssh ok",
      "note": "macOS 15.5 · Mac16,10 · 16 GB · load 1.15 · sleep prevented by powerd · herdr 0.6.5 · codex-cli 0.153.4 · Bifrost :8080 answers 200. The Mini clock reads 14:43 (its zone is one hour ahead of UTC; the laptop is +07).",
      "facts": [
        {
          "k": "route in use",
          "v": "Tailscale (<code>ssh mac-mini-ts</code>, <code>mini-herdr</code> = <code>herdr --remote mac-mini-herdr</code>)"
        },
        {
          "k": "route intended",
          "v": "Cloudflare WARP private route (ESTATE.md: \"already the primary, not Tailscale\"); down 5 Sep, no reply 6 Sep"
        },
        {
          "k": "owner of bring-up",
          "v": "LAPTOP-ORGANIZER (briefs/MINI-SYNC.md, N1)"
        },
        {
          "k": "GQ",
          "v": "GQ-017 · what runs on laptop, Mini and client VPS"
        }
      ]
    },
    "metrics": [
      {
        "value": 3,
        "label": "routes",
        "tone": "now",
        "href": "#reach"
      },
      {
        "value": 7,
        "label": "probes, dated",
        "tone": "muted",
        "href": "#reach"
      },
      {
        "value": 4,
        "label": "seats on the node",
        "tone": "agents",
        "href": "#runs"
      },
      {
        "value": 5,
        "label": "nodes in the estate",
        "tone": "projects",
        "href": "#nodes"
      }
    ],
    "jump": [
      {
        "label": "Reachable, by which route",
        "href": "#reach"
      },
      {
        "label": "What runs there",
        "href": "#runs"
      },
      {
        "label": "Capacity · budget",
        "href": "#capacity"
      },
      {
        "label": "Placement rule",
        "href": "#placement"
      },
      {
        "label": "The other nodes",
        "href": "#nodes"
      },
      {
        "label": "Evidence",
        "href": "#evidence"
      }
    ]
  },
  "sections": {
    "reach": {
      "n": "01",
      "title": "Reachable, by which route",
      "sub": "three routes, each with its last probe; commands are the read-only ones in the repo"
    },
    "runs": {
      "n": "02",
      "title": "What runs there",
      "sub": "mini-herdr agent list 20:38 · last writeback from atlas/now.json 20:29"
    },
    "capacity": {
      "n": "03",
      "title": "Capacity · budget",
      "sub": "sysctl, df, pmset over ssh at 20:43; what is not measured says so"
    },
    "placement": {
      "n": "04",
      "title": "Placement rule",
      "sub": "briefs/MINI-SYNC.md, 6 Sep 00:30"
    },
    "nodes": {
      "n": "05",
      "title": "The other nodes",
      "sub": "ESTATE.md nodes table + today's seat counts"
    },
    "evidence": {
      "n": "06",
      "title": "Evidence"
    },
    "timeline": {
      "n": "07",
      "title": "Bring-up"
    },
    "related": {
      "n": "08",
      "title": "Links"
    },
    "agent": {
      "n": "09",
      "title": "Agent entry"
    }
  },
  "routes": [
    {
      "route": "Tailscale",
      "state": "up · ssh answered",
      "tone": "now",
      "icon": "check",
      "how": "<code>ssh -o BatchMode=yes mac-mini-ts</code> returned hostname, sysctl, uptime; <code>mini-herdr agent list</code> returned 4 agents at 20:38. ESTATE.md calls Tailscale the legacy fallback; today it is the only route that carries traffic.",
      "probed": "2026-09-06 20:43 +07"
    },
    {
      "route": "Cloudflare WARP private route",
      "state": "route present · no reply",
      "tone": "blocked",
      "icon": "x",
      "how": "<code>bin/mini-probe</code>: \"MINI unreachable: ping=fail warp_route=ok ssh=fail\". Same verdict as estate/MINI-STATUS.md on 5 Sep. Pilot note: cloudflared runs on the Mini as a token-managed system daemon; the Mini's current interface address differs from the historical destination; origin certificate absent on both machines so advertised routes could not be inspected.",
      "probed": "2026-09-06 20:43 +07"
    },
    {
      "route": "Interactive attach (herdr)",
      "state": "rendered · 6 Sep pilot",
      "tone": "now",
      "icon": "terminal",
      "how": "<code>env -u HERDR_ENV -u HERDR_SESSION herdr --remote mac-mini-herdr --session default</code> rendered the default-session UI (owner labels AGENCY, INTENT). First attempt inherited the laptop session name and started an empty named server, which was stopped; no owner runtime closed.",
      "probed": "2026-09-06 (mini-native-pilot.json)"
    }
  ],
  "probes": [
    {
      "what": "ssh over Tailscale",
      "cmd": "ssh -T -o BatchMode=yes -o ConnectTimeout=6 -o RemoteCommand=none mac-mini-ts 'hostname; sysctl -n hw.model hw.memsize; sw_vers -productVersion; uptime; df -h /; pmset -g'",
      "result": "ok",
      "tone": "now",
      "note": "Mac16,10 · 16 GB · 15.5 · up 8 days 23:09 · sleep 0 (prevented by powerd)",
      "at": "2026-09-06 20:43",
      "by": "TEMPLATE-BANK-ZERO-2"
    },
    {
      "what": "WARP route probe",
      "cmd": "00_AGENT_ZERO/bin/mini-probe",
      "result": "unreachable",
      "tone": "blocked",
      "note": "ping=fail warp_route=ok ssh=fail (read-only: route inspection, one ICMP echo, ssh running only <code>true</code>)",
      "at": "2026-09-06 20:43",
      "by": "TEMPLATE-BANK-ZERO-2"
    },
    {
      "what": "herdr agent list",
      "cmd": "mini-herdr agent list",
      "result": "4 agents",
      "tone": "now",
      "note": "ERDOS-LEAD idle · SISO-PERF-SOL idle · PLAYS-ZERO done · INTENT-DISTILLATION done, all codex",
      "at": "2026-09-06 20:38",
      "by": "TEMPLATE-BANK-ZERO-2"
    },
    {
      "what": "Bifrost",
      "cmd": "curl -s -o /dev/null -w %{http_code} http://127.0.0.1:8080/ (on the Mini)",
      "result": "200",
      "tone": "now",
      "at": "2026-09-06 20:43",
      "by": "TEMPLATE-BANK-ZERO-2"
    },
    {
      "what": "Astra inference on the Mini",
      "cmd": "codex exec --model gpt-6-astra (invocation-only openai provider, native catalog/context overrides)",
      "result": "ASTRA_MINI_OK",
      "tone": "now",
      "note": "exit 0; rollout recorded in the pilot ledger",
      "at": "2026-09-06 (pilot)",
      "by": "LAPTOP-ORGANIZER"
    },
    {
      "what": "MINI-SYNC verification",
      "cmd": "ssh mini-fast (herdr, codex, claude, gh, git, Bifrost, free memory, disk, sleep)",
      "result": "up · no live agents then",
      "tone": "muted",
      "note": "\"herdr 0.6.5 server up (no live agents), codex + claude 2.1.220 + gh + git installed and authed, Bifrost on :8080, 6 GB free, 20 GB disk, sleep prevented … Only Tailscale reaches it\"",
      "at": "2026-09-06 00:05",
      "by": "Fable FA0"
    },
    {
      "what": "WARP route probe",
      "cmd": "bin/mini-probe",
      "result": "unreachable",
      "tone": "blocked",
      "note": "estate/MINI-STATUS.md: WARP route present on utun5; ping and ssh failed",
      "at": "2026-09-05 02:41",
      "by": "LAPTOP-ORGANIZER"
    }
  ],
  "seats": [
    {
      "name": "ERDOS-LEAD",
      "harness": "codex",
      "status": "idle",
      "tone": "warn",
      "cwd": "~/SISO_Workspace/Great_Library_of_SISO/works/erdos",
      "last": "none in scanned logs",
      "href": "/t/U6/example/"
    },
    {